{
  "schema_version": "1.0.0",
  "migration_id": "context-compounding-legacy-data-1.14.0",
  "target_package_version": "1.14.0",
  "generated_at": "2026-06-20T07:49:18.281950Z",
  "principles": {
    "historical_records_are_immutable": true,
    "derived_sample_data_is_not_canonical": true,
    "missing_original_sources_remain_blocking": true,
    "migration_uses_overlay_index": true,
    "automatic_policy_promotion": false
  },
  "artifacts": [
    {
      "path": "projects/sample_independent_loops/improvement_candidates_100.json",
      "sha256": "sha256:99bc3663f430eea278d47e9ec98f903e388045e69bb5e7acba7fa2be3a342afc",
      "classification": "historical_structured_data",
      "authority": "historical_evidence_only",
      "migration_status": "legacy_preserved_with_overlay",
      "current_use": "episodic_evidence"
    },
    {
      "path": "projects/sample_independent_loops/improvement_candidates_100_summary.md",
      "sha256": "sha256:e689d4847ceeb41d6989eecb9f2146d18458b5b94c93d2616473a26c92c89cb7",
      "classification": "historical_summary",
      "authority": "secondary_summary",
      "migration_status": "legacy_preserved_with_overlay",
      "current_use": "historical_summary"
    },
    {
      "path": "projects/sample_independent_loops/run_100_task_batch.py",
      "sha256": "sha256:b6ce47ae551b43cf91938f650d6b62b0c4e61cfd2647474d10aa5b9a6e108ae4",
      "classification": "project_tooling",
      "authority": "tooling_not_instruction_authority",
      "migration_status": "legacy_preserved_with_overlay",
      "current_use": "project_tooling"
    },
    {
      "path": "projects/sample_independent_loops/run_manifest.json",
      "sha256": "sha256:3207dbe524cc0148b44820b84c26adfb343aa67073ec18e9b7d8e37b4662db5a",
      "classification": "historical_structured_data",
      "authority": "historical_evidence_only",
      "migration_status": "legacy_preserved_with_overlay",
      "current_use": "episodic_evidence"
    },
    {
      "path": "projects/sample_independent_loops/run_sequential_100_improvements.py",
      "sha256": "sha256:1af5f6b555dc2816f9ba248df6169cc5646c53fc5d1442b5d81b288ef7e8411e",
      "classification": "project_tooling",
      "authority": "tooling_not_instruction_authority",
      "migration_status": "legacy_preserved_with_overlay",
      "current_use": "project_tooling"
    },
    {
      "path": "projects/sample_independent_loops/sample_01_muhan_regression/agent_recreation_v1.md",
      "sha256": "sha256:c1b1e35fd01233c58b9b7b48c8f25c91158148b41789c0e4a7741e38f5752af9",
      "classification": "historical_candidate",
      "authority": "candidate_not_canonical",
      "migration_status": "legacy_preserved_with_overlay",
      "current_use": "episodic_evidence"
    },
    {
      "path": "projects/sample_independent_loops/sample_01_muhan_regression/agent_recreation_v2.md",
      "sha256": "sha256:acefe7a1d96b0c5e81ef216c2ebeeda6bb980a24810db42d5847daf089f5e500",
      "classification": "historical_candidate",
      "authority": "candidate_not_canonical",
      "migration_status": "legacy_preserved_with_overlay",
      "current_use": "episodic_evidence"
    },
    {
      "path": "projects/sample_independent_loops/sample_01_muhan_regression/agent_recreation_v3.md",
      "sha256": "sha256:393c7a4c7a5578b2228995349ec3b1b4a1c5f2797031729f30d9413bb28c692f",
      "classification": "historical_candidate",
      "authority": "candidate_not_canonical",
      "migration_status": "legacy_preserved_with_overlay",
      "current_use": "episodic_evidence"
    },
    {
      "path": "projects/sample_independent_loops/sample_01_muhan_regression/agent_recreation_v4.md",
      "sha256": "sha256:e8ad7aa20f7a8ef2b7c3a2998b7997f146e6779c65f96af36652b0ff85b2416c",
      "classification": "historical_candidate",
      "authority": "candidate_not_canonical",
      "migration_status": "legacy_preserved_with_overlay",
      "current_use": "episodic_evidence"
    },
    {
      "path": "projects/sample_independent_loops/sample_01_muhan_regression/component_versions.json",
      "sha256": "sha256:b59770b10256d96f4bd8e0e1e1ad2c8d58e91483e9a6ca4032e0688e476fbdd0",
      "classification": "current_control_artifact",
      "authority": "current_control_evidence",
      "migration_status": "current_control_generated",
      "current_use": "current_control"
    },
    {
      "path": "projects/sample_independent_loops/sample_01_muhan_regression/context_plan.json",
      "sha256": "sha256:a571af2e1f0dd0a1bffe35985c1189a0a3924188de7877742c2b2d32cf70145c",
      "classification": "current_control_artifact",
      "authority": "current_control_evidence",
      "migration_status": "current_control_generated",
      "current_use": "current_control"
    },
    {
      "path": "projects/sample_independent_loops/sample_01_muhan_regression/current_gate_status.json",
      "sha256": "sha256:de66f7ec852d21bb33e44c4a4fb241f74bda26d6f7bb9555203b9407937fd836",
      "classification": "current_control_artifact",
      "authority": "current_control_evidence",
      "migration_status": "current_control_generated",
      "current_use": "current_control"
    },
    {
      "path": "projects/sample_independent_loops/sample_01_muhan_regression/element_pack.json",
      "sha256": "sha256:7317c9c27a95f51718b4f2d7f9fcc6449d850eee267bea75865f659400265f67",
      "classification": "derived_sample_evidence",
      "authority": "derived_evidence_not_canonical",
      "migration_status": "legacy_preserved_with_overlay",
      "current_use": "derived_evidence"
    },
    {
      "path": "projects/sample_independent_loops/sample_01_muhan_regression/evaluation_v1.json",
      "sha256": "sha256:80751f44bccc08e0469b87873816846fd218354ff61579c3ea2127d930d3ef6a",
      "classification": "historical_evaluation",
      "authority": "episodic_evidence_only",
      "migration_status": "legacy_preserved_with_overlay",
      "current_use": "episodic_evidence"
    },
    {
      "path": "projects/sample_independent_loops/sample_01_muhan_regression/evaluation_v2.json",
      "sha256": "sha256:daf1e5738e15c2226beaed204de1d741894dbf49f0ba9248e947542d8d4fa0ca",
      "classification": "historical_evaluation",
      "authority": "episodic_evidence_only",
      "migration_status": "legacy_preserved_with_overlay",
      "current_use": "episodic_evidence"
    },
    {
      "path": "projects/sample_independent_loops/sample_01_muhan_regression/evaluation_v3.json",
      "sha256": "sha256:5c72162d36d13a0275c203b6f2d8cb9734c24e2af4a768dfca94083ea0fb13c2",
      "classification": "historical_evaluation",
      "authority": "episodic_evidence_only",
      "migration_status": "legacy_preserved_with_overlay",
      "current_use": "episodic_evidence"
    },
    {
      "path": "projects/sample_independent_loops/sample_01_muhan_regression/evaluation_v4.json",
      "sha256": "sha256:d191fc67f25681c27f56ed712d7bff699e7289da08bca770744f1abe0baa9416",
      "classification": "historical_evaluation",
      "authority": "episodic_evidence_only",
      "migration_status": "legacy_preserved_with_overlay",
      "current_use": "episodic_evidence"
    },
    {
      "path": "projects/sample_independent_loops/sample_01_muhan_regression/evidence_pack.json",
      "sha256": "sha256:d492525dbe1b86a81df675bd3b75f155582849071a9bfcff98afa10e229604c8",
      "classification": "current_control_artifact",
      "authority": "current_control_evidence",
      "migration_status": "current_control_generated",
      "current_use": "current_control"
    },
    {
      "path": "projects/sample_independent_loops/sample_02_dimension_transfer/agent_recreation_v1.md",
      "sha256": "sha256:a88faadf14586adb4edafc6d50bfe7f7d9f4c8b31fed59f880116c9eb0901db2",
      "classification": "historical_candidate",
      "authority": "candidate_not_canonical",
      "migration_status": "legacy_preserved_with_overlay",
      "current_use": "episodic_evidence"
    },
    {
      "path": "projects/sample_independent_loops/sample_02_dimension_transfer/agent_recreation_v2.md",
      "sha256": "sha256:0487b340296dd59a7c7af5cd9713b8f27a4f42cc9181c14d1ba12fcfb322f41d",
      "classification": "historical_candidate",
      "authority": "candidate_not_canonical",
      "migration_status": "legacy_preserved_with_overlay",
      "current_use": "episodic_evidence"
    },
    {
      "path": "projects/sample_independent_loops/sample_02_dimension_transfer/agent_recreation_v3.md",
      "sha256": "sha256:b56ded5de3b9562f8c72027fda4869636783cc336c683c8c229b41a7f2d77842",
      "classification": "historical_candidate",
      "authority": "candidate_not_canonical",
      "migration_status": "legacy_preserved_with_overlay",
      "current_use": "episodic_evidence"
    },
    {
      "path": "projects/sample_independent_loops/sample_02_dimension_transfer/agent_recreation_v4.md",
      "sha256": "sha256:2e11cf497ce1b319c6be04518a508540905b3ab18f8f84f494716e202e9fc02c",
      "classification": "historical_candidate",
      "authority": "candidate_not_canonical",
      "migration_status": "legacy_preserved_with_overlay",
      "current_use": "episodic_evidence"
    },
    {
      "path": "projects/sample_independent_loops/sample_02_dimension_transfer/component_versions.json",
      "sha256": "sha256:b59770b10256d96f4bd8e0e1e1ad2c8d58e91483e9a6ca4032e0688e476fbdd0",
      "classification": "current_control_artifact",
      "authority": "current_control_evidence",
      "migration_status": "current_control_generated",
      "current_use": "current_control"
    },
    {
      "path": "projects/sample_independent_loops/sample_02_dimension_transfer/context_plan.json",
      "sha256": "sha256:aa11387877b9616a048b9e856048c173bb5102a616b9b4854d385d106e97e700",
      "classification": "current_control_artifact",
      "authority": "current_control_evidence",
      "migration_status": "current_control_generated",
      "current_use": "current_control"
    },
    {